{
    "id": "feudalism",
    "name": "Feudalism",
    "description": "Your nationâ€™s rule is vested in a dynastic royal family, though much of the real power is distributed among their vassals and fiefdoms.",
    "boosts": [
        "stability",
        "culture"
    ],
    "freeBoosts": 1,
    "bonusFeat": "fortified-fiefs",
    "skillProficiencies": [
        "defense",
        "trade"
    ]
}