{
    "id": "republic",
    "name": "governments.republic.name",
    "description": "governments.republic.description",
    "boosts": [
        "stability",
        "loyalty"
    ],
    "freeBoosts": 1,
    "bonusFeat": "pull-together",
    "skillProficiencies": [
        "engineering",
        "politics"
    ]
}