{
    "id": "thaumocracy",
    "name": "Thaumocracy",
    "description": "Your nation is governed by those most skilled in magic, using their knowledge and power to determine the best ways to rule. While the type of magic wielded by the nation’s rulers can adjust its themes (or even its name—a thaumocracy run by divine spellcasters would be a theocracy, for example), the details below remain the same whether it’s arcane, divine, occult, primal, or any combination of the four.",
    "boosts": [
        "economy",
        "culture"
    ],
    "freeBoosts": 1,
    "bonusFeat": "Practical Magic",
    "skillProficiencies": [
        "folklore",
        "magic"
    ]
}