{
    "id": "despotism",
    "name": "governments.despotism.name",
    "description": "governments.despotism.description",
    "boosts": [
        "stability",
        "economy"
    ],
    "freeBoosts": 1,
    "bonusFeat": "crush-dissent",
    "skillProficiencies": [
        "intrigue",
        "warfare"
    ]
}